{"$id":"https://autocut.invalid/contracts/2.1.3/stage_02/contributions/stage-02-owner-contribution.manifest.schema.json","$schema":"https://json-schema.org/draft/2020-12/schema","additionalProperties":false,"properties":{"b_input":{"const":{"handoff_git_commit":"50f78ea0b7f754eb8f91ef800924b86da25b3083","handoff_raw_sha256":"sha256:07fd0e9d4dbe03050f9aa3f4823755e4ba1e7f4852a163ab2fa291c0b3710eb6","producer_git_commit":"eb7e4181f63da308c405bad6d99fcd085cfdd98a","used_primitive_blobs":[{"path":"schemas/primitives/artifact-ref.schema.json","raw_sha256":"sha256:9df321d5ccc33dd8ff307aae6f33d1e4d2accfc278ea4fb5ed11072e5e5295db"},{"path":"schemas/primitives/artifact-set-ref.schema.json","raw_sha256":"sha256:ddbbaf9bb866c97fa5c4ee9bbe1f78053f03a09abed529846bc5a3b0893a97a4"},{"path":"schemas/primitives/domain-ref.schema.json","raw_sha256":"sha256:72211809fa19f967345ccc41574fea5319feb40bcbde05a3564cf6bc8c63f896"},{"path":"schemas/primitives/immutable-blob-ref.schema.json","raw_sha256":"sha256:52d4ea27825976cecc86e2d96d2388acb0aa885799adb708d6f0db616cc10678"},{"path":"schemas/primitives/scope.schema.json","raw_sha256":"sha256:e0376bbb53ea1ddcc69b371231fb81d2bd948f7f52565e452df413e9499b53ac"},{"path":"schemas/primitives/source-span-ref.schema.json","raw_sha256":"sha256:586c57b03f44a455478d722ab3012dcb33932fcc49fe0d0d847d9cfa2043bb29"}]}},"closed_self_exclusion_protocol":{"const":{"exclusion_reason":"self_reference","external_attestation":"C2-A","external_attestation_bound_files":[{"path":"contributions/stage-02-owner-contribution.manifest.json"},{"path":"contributions/stage-02-owner-contribution.manifest.schema.json"}],"external_attestation_boundary":"independent","hash_binding_requirement":"later_independent_C2-A_attestation","producer_file_count_breakdown":{"external_attestation_bound_files":2,"hashed_source_files":10,"total_files":12}}},"contract_version":{"const":"2.1.3"},"deferred_bindings":{"const":["B0-012 remains unresolved.","B0-028/AC-B-008 remains unresolved.","AC-B-005 remains unresolved.","AC-B-007 remains unresolved.","AC-B-001/002/009 remains unresolved.","F/G/H ownership remains unresolved."]},"format":{"const":"autocut.stage-02-owner-contribution/v1"},"producer_base_commit":{"const":"50f78ea0b7f754eb8f91ef800924b86da25b3083"},"producer_file_count":{"const":12},"producer_files":{"items":false,"maxItems":10,"minItems":10,"prefixItems":[{"additionalProperties":false,"properties":{"path":{"const":"contracts/stage-02-source-obligations.json"},"raw_sha256":{"pattern":"^sha256:[0-9a-f]{64}$","type":"string"}},"required":["path","raw_sha256"],"type":"object"},{"additionalProperties":false,"properties":{"path":{"const":"fixtures/stage-02-structural-valid.json"},"raw_sha256":{"pattern":"^sha256:[0-9a-f]{64}$","type":"string"}},"required":["path","raw_sha256"],"type":"object"},{"additionalProperties":false,"properties":{"path":{"const":"shapes/candidate-capability.local-shape.json"},"raw_sha256":{"pattern":"^sha256:[0-9a-f]{64}$","type":"string"}},"required":["path","raw_sha256"],"type":"object"},{"additionalProperties":false,"properties":{"path":{"const":"shapes/candidate-catalog.local-shape.json"},"raw_sha256":{"pattern":"^sha256:[0-9a-f]{64}$","type":"string"}},"required":["path","raw_sha256"],"type":"object"},{"additionalProperties":false,"properties":{"path":{"const":"shapes/candidate-measurement.local-shape.json"},"raw_sha256":{"pattern":"^sha256:[0-9a-f]{64}$","type":"string"}},"required":["path","raw_sha256"],"type":"object"},{"additionalProperties":false,"properties":{"path":{"const":"shapes/portfolio-local-fields.local-shape.json"},"raw_sha256":{"pattern":"^sha256:[0-9a-f]{64}$","type":"string"}},"required":["path","raw_sha256"],"type":"object"},{"additionalProperties":false,"properties":{"path":{"const":"shapes/portfolio.local-shape.json"},"raw_sha256":{"pattern":"^sha256:[0-9a-f]{64}$","type":"string"}},"required":["path","raw_sha256"],"type":"object"},{"additionalProperties":false,"properties":{"path":{"const":"shapes/proposal-set.local-shape.json"},"raw_sha256":{"pattern":"^sha256:[0-9a-f]{64}$","type":"string"}},"required":["path","raw_sha256"],"type":"object"},{"additionalProperties":false,"properties":{"path":{"const":"shapes/story-design.local-shape.json"},"raw_sha256":{"pattern":"^sha256:[0-9a-f]{64}$","type":"string"}},"required":["path","raw_sha256"],"type":"object"},{"additionalProperties":false,"properties":{"path":{"const":"tests/test-stage-02-owner-source.json"},"raw_sha256":{"pattern":"^sha256:[0-9a-f]{64}$","type":"string"}},"required":["path","raw_sha256"],"type":"object"}],"type":"array"},"producer_manifest_path":{"const":"contributions/stage-02-owner-contribution.manifest.json"},"repository_validation":{"additionalProperties":false,"properties":{"path":{"const":"tests/contracts/test_stage02_owner_contribution.py"},"raw_sha256":{"const":"sha256:62ea0e075ec200c19dead7209ae2430e51cc2c256c4d6a5f5d427d5e8457c622","pattern":"^sha256:[0-9a-f]{64}$","type":"string"}},"required":["path","raw_sha256"],"type":"object"}},"required":["format","contract_version","producer_base_commit","b_input","producer_manifest_path","producer_file_count","producer_files","repository_validation","deferred_bindings","closed_self_exclusion_protocol"],"type":"object"}