{"b_input":{"handoff_git_commit":"50f78ea0b7f754eb8f91ef800924b86da25b3083","handoff_raw_sha256":"sha256:07fd0e9d4dbe03050f9aa3f4823755e4ba1e7f4852a163ab2fa291c0b3710eb6","producer_git_commit":"eb7e4181f63da308c405bad6d99fcd085cfdd98a","used_primitive_blobs":[{"path":"schemas/primitives/artifact-ref.schema.json","raw_sha256":"sha256:9df321d5ccc33dd8ff307aae6f33d1e4d2accfc278ea4fb5ed11072e5e5295db"},{"path":"schemas/primitives/artifact-set-ref.schema.json","raw_sha256":"sha256:ddbbaf9bb866c97fa5c4ee9bbe1f78053f03a09abed529846bc5a3b0893a97a4"},{"path":"schemas/primitives/domain-ref.schema.json","raw_sha256":"sha256:72211809fa19f967345ccc41574fea5319feb40bcbde05a3564cf6bc8c63f896"},{"path":"schemas/primitives/immutable-blob-ref.schema.json","raw_sha256":"sha256:52d4ea27825976cecc86e2d96d2388acb0aa885799adb708d6f0db616cc10678"},{"path":"schemas/primitives/scope.schema.json","raw_sha256":"sha256:e0376bbb53ea1ddcc69b371231fb81d2bd948f7f52565e452df413e9499b53ac"},{"path":"schemas/primitives/source-span-ref.schema.json","raw_sha256":"sha256:586c57b03f44a455478d722ab3012dcb33932fcc49fe0d0d847d9cfa2043bb29"}]},"closed_self_exclusion_protocol":{"exclusion_reason":"self_reference","external_attestation":"C2-A","external_attestation_bound_files":[{"path":"contributions/stage-02-owner-contribution.manifest.json"},{"path":"contributions/stage-02-owner-contribution.manifest.schema.json"}],"external_attestation_boundary":"independent","hash_binding_requirement":"later_independent_C2-A_attestation","producer_file_count_breakdown":{"external_attestation_bound_files":2,"hashed_source_files":10,"total_files":12}},"contract_version":"2.1.3","deferred_bindings":["B0-012 remains unresolved.","B0-028/AC-B-008 remains unresolved.","AC-B-005 remains unresolved.","AC-B-007 remains unresolved.","AC-B-001/002/009 remains unresolved.","F/G/H ownership remains unresolved."],"format":"autocut.stage-02-owner-contribution/v1","producer_base_commit":"50f78ea0b7f754eb8f91ef800924b86da25b3083","producer_file_count":12,"producer_files":[{"path":"contracts/stage-02-source-obligations.json","raw_sha256":"sha256:b09a9a2510a94c1862cc26a60503342d0dd8c253e698c8afde05be0a770a3d78"},{"path":"fixtures/stage-02-structural-valid.json","raw_sha256":"sha256:611ac8e0fa2c808de4dba282f163da271585e05f633043fe1d910ea5b6262678"},{"path":"shapes/candidate-capability.local-shape.json","raw_sha256":"sha256:c546fb4d9d61423acf82fe7c880d37b7e769a4f5622ecbd08435ab24e08c4eda"},{"path":"shapes/candidate-catalog.local-shape.json","raw_sha256":"sha256:5e83bd051b1b7dcacca53c231b6a1f5c8d14603ef655b4d42b135a09022283bb"},{"path":"shapes/candidate-measurement.local-shape.json","raw_sha256":"sha256:2c4d8dc94a7732c5828fd9b347fe643d8a6e1b5ef9def28372db7017c3309bbe"},{"path":"shapes/portfolio-local-fields.local-shape.json","raw_sha256":"sha256:4f18b86d6c161a7ae3975463c22c8aeefc10e86c5772d8246b170e5ab890021a"},{"path":"shapes/portfolio.local-shape.json","raw_sha256":"sha256:e0a4a0e1e373f70d05dc1fb0343949ed236c7d5b0c8ea2911482797a13e82368"},{"path":"shapes/proposal-set.local-shape.json","raw_sha256":"sha256:1b0b63175655e58020224441c7870be97ff458d7180b5ca01f2b3609bc859a1c"},{"path":"shapes/story-design.local-shape.json","raw_sha256":"sha256:aedf06d0c8db276de3f22d086ac4c4a3f8ea34e5355fffb1b709527083a511c1"},{"path":"tests/test-stage-02-owner-source.json","raw_sha256":"sha256:f5d632e537f1dc1e13a15d27fadb09e5af68bd74266f0e2b6513b23cbb337cb5"}],"producer_manifest_path":"contributions/stage-02-owner-contribution.manifest.json","repository_validation":{"path":"tests/contracts/test_stage02_owner_contribution.py","raw_sha256":"sha256:62ea0e075ec200c19dead7209ae2430e51cc2c256c4d6a5f5d427d5e8457c622"}}